{
  "slug": "parr-instrument-company",
  "title": "Parr Instrument Company",
  "date": "Mon, 20 Apr 2026 18:03:00 +0000",
  "content": "<p>Parr Instrument Company is a U.S. manufacturer of laboratory reactors, pressure vessels, and custom high-pressure systems used in advanced materials process development. The company’s official supercritical fluids portfolio includes systems for supercritical drying, which is directly relevant to aerogel manufacturing workflows and pilot-scale process work. Parr equipment is widely used in research laboratories and industrial development programs that require controlled pressure and temperature conditions.</p>",
  "excerpt": "",
  "website": "https://www.parrinst.com/",
  "certifications": "",
  "verified": "",
  "review_status": "reviewed",
  "review_notes": "Directory profile reviewed for listing quality, category fit, and current public website availability.",
  "category": [
    "Equipment Materials"
  ],
  "location": [
    "United States of America"
  ],
  "main_products": [
    "Aerogel Pipe Shell &amp; Cover",
    "Laboratory Equipment &amp; Instruments",
    "Process Equipment &amp; Pilot Systems"
  ],
  "application_fields": [
    "Industrial Insulation",
    "Materials Research &amp; Development",
    "Process Scale-Up &amp; Manufacturing"
  ],
  "hero": ""
}