{
  "slug": "insulcon-group-netherlands-aerogel-blanket-distributor",
  "title": "Insulcon Group | Netherlands Aerogel Blanket Distributor",
  "date": "Fri, 22 May 2026 07:30:21 +0000",
  "content": "<p>The Insulcon Group is a leading European distributor and converter of high-temperature insulation solutions, headquartered in Steenbergen, the Netherlands. Founded in 1980 and part of the IPCOM Group since 2015, Insulcon supplies a comprehensive range of thermal insulation products and engineered systems to industrial customers across Europe and worldwide.</p>\n<p>Insulcon is an authorized distributor of <strong>Aspen Aerogels</strong> products, offering the full range of Pyrogel® and Cryogel® aerogel insulation blankets. These include Pyrogel® XTE for corrosion-under-insulation protection in medium-to-high temperature service, Pyrogel® XTF combining thermal insulation with passive fire protection, Pyrogel® HPS optimized for high-temperature hydrocarbon and chemical processing, and Cryogel® Z for cryogenic and sub-ambient applications down to −200 °C. Insulcon provides tailored, CNC-waterjet-cut aerogel insulation sections for pipes, elbows, valves, vessels, and other equipment.</p>\n<ul>\n<li><strong>Coverage Area:</strong> Europe-wide distribution with offices and facilities in the Netherlands, Belgium, Germany, United Kingdom, Switzerland, Italy, Hungary, and France; global network of dedicated agents</li>\n<li><strong>Focus Areas:</strong> High-temperature insulation, cryogenic insulation, passive fire protection, aerogel blanket distribution and conversion, petrochemical and LNG insulation, power generation insulation, marine and offshore insulation</li>\n<li><strong>Current Brands Represented:</strong> Aspen Aerogels (Pyrogel®, Cryogel®), Insulcon proprietary Calcon calcium silicate, Insulboard MPU microporous products, and additional refractory and fibre-based insulation brands</li>\n<li><strong>Official Website:</strong> <a href=\"https://www.insulcon.com\">www.insulcon.com</a></li>\n</ul>\n<p>The company&rsquo;s official website confirms distribution and conversion of aerogel insulation blankets across petrochemical, LNG, power generation, offshore, and industrial markets. Insulcon operates state-of-the-art CNC waterjet cutting facilities and an in-house engineering department to deliver project-specific aerogel insulation solutions, including pre-formed sections for piping and equipment, with cladding supplied as an integrated one-stop-shop offering.</p>\n<!-- Workflow marker: Aerogela Auto Listing Series -->",
  "excerpt": "",
  "website": "https://www.insulcon.com",
  "certifications": "",
  "verified": "",
  "review_status": "reviewed",
  "review_notes": "Official website confirms distribution of Aspen Aerogels Pyrogel and Cryogel products. Company profile, product range, and contact details verified on insulcon.com.",
  "category": [
    "Distributors"
  ],
  "location": [
    "Netherlands"
  ],
  "main_products": [
    "Aerogel Insulation Blanket",
    "Aerogel Materials Distribution"
  ],
  "application_fields": [
    "Fire Protection &amp; Thermal Safety",
    "Industrial Insulation",
    "LNG &amp; Cryogenic Systems",
    "Petrochemical &amp; Oil &amp; Gas"
  ],
  "hero": ""
}