{
  "slug": "canadian-light-source",
  "title": "Canadian Light Source",
  "date": "Tue, 21 Apr 2026 19:26:40 +0000",
  "content": "<p>The Canadian Light Source (CLS) is Canada's national synchrotron light source, a third-generation 2.9 GeV facility at the University of Saskatchewan in Saskatoon that opened in 2004. Operated by Canadian Light Source Inc., it serves over 1,000 academic, government and industry researchers annually across beamlines offering X-ray spectroscopy, diffraction and imaging from the macro to the nanoscale.</p><p>These tools support advanced materials research, including non-destructive study of pore structure and chemistry in porous and nanostructured materials such as aerogels. A dedicated Industry Services group provides fee-for-service access, from purchased beamtime to full-service experimental design, execution and analysis, letting companies access world-class characterization without owning the instruments.</p>",
  "excerpt": "Canada's national synchrotron in Saskatoon, offering spectroscopy, diffraction and imaging beamlines plus fee-for-service industry characterization.",
  "website": "https://www.lightsource.ca/",
  "certifications": "",
  "verified": "",
  "review_status": "reviewed",
  "review_notes": "Directory profile reviewed for listing quality, category fit, and current public website availability.",
  "category": [
    "Research Services"
  ],
  "location": [
    "Canada"
  ],
  "main_products": [
    "Aerogel R&D and Testing Services"
  ],
  "application_fields": [
    "Materials Research & Development",
    "Testing & Characterization"
  ],
  "hero": ""
}
