{
  "slug": "hielscher-ultrasonics",
  "title": "Hielscher Ultrasonics",
  "date": "Mon, 20 Apr 2026 18:25:00 +0000",
  "content": "<p>Hielscher Ultrasonics is a German manufacturer of ultrasonic processors used for dispersing, homogenizing, emulsifying, and nanoparticle processing. These tools are relevant to sol-gel and aerogel precursor preparation where stable dispersions and controlled particle processing can matter during formulation work. Hielscher is a useful Equipment Materials listing for laboratories and pilot teams working on advanced porous-material systems.</p>",
  "excerpt": "",
  "website": "https://www.hielscher.com/",
  "certifications": "",
  "verified": "",
  "review_status": "reviewed",
  "review_notes": "Directory profile reviewed for listing quality, category fit, and current public website availability.",
  "category": [
    "Equipment Materials"
  ],
  "location": [
    "Germany"
  ],
  "main_products": [
    "Aerogel Coating &amp; Slurry",
    "Aerogel Powder &amp; Granules"
  ],
  "application_fields": [
    "Materials Research &amp; Development",
    "Process Scale-Up &amp; Manufacturing"
  ],
  "hero": ""
}