{
  "slug": "imcd-n-v",
  "title": "IMCD N.V.",
  "date": "Wed, 15 Apr 2026 08:59:04 +0000",
  "content": "<p>IMCD is a global specialty chemicals distributor headquartered in the Netherlands. In the aerogel segment, the company has distributed aerogel materials in Nordic and Baltic markets while supporting customers through technical sales and formulation expertise.</p>\n<ul>\n  <li><strong>Coverage Area:</strong> Nordic and Baltic countries, with wider European reach</li>\n  <li><strong>Focus Areas:</strong> Specialty chemical distribution, aerogel powders for industrial applications, and formulation support</li>\n  <li><strong>Current Brands Represented:</strong> Svenska Aerogel (Quartzene®)</li>\n  <li><strong>Official Website:</strong> <a href=\"https://www.imcdgroup.com/\" target=\"_blank\" rel=\"noopener\">https://www.imcdgroup.com/</a></li>\n</ul>",
  "excerpt": "",
  "website": "https://www.imcdgroup.com/",
  "certifications": "",
  "verified": "",
  "review_status": "reviewed",
  "review_notes": "Directory profile reviewed for listing quality, category fit, and current public website availability.",
  "category": [
    "Distributors"
  ],
  "location": [
    "Netherlands"
  ],
  "main_products": [
    "Aerogel Coating &amp; Slurry",
    "Aerogel Powder &amp; Granules"
  ],
  "application_fields": [
    "Industrial Insulation",
    "Materials Research &amp; Development"
  ],
  "hero": ""
}