{
  "slug": "fritsch",
  "title": "FRITSCH",
  "date": "Mon, 20 Apr 2026 18:21:00 +0000",
  "content": "<p>FRITSCH is a German milling and sizing manufacturer offering planetary mills, ball mills, jaw crushers, and related sample-preparation equipment. These tools are relevant to aerogel R&D and precursor solids processing where consistent particle handling and laboratory preparation matter. FRITSCH is a useful Equipment Materials listing for advanced materials teams working with powders and brittle solid inputs.</p>",
  "excerpt": "",
  "website": "https://www.fritsch-international.com/",
  "certifications": "",
  "verified": "",
  "review_status": "reviewed",
  "review_notes": "Directory profile reviewed for listing quality, category fit, and current public website availability.",
  "category": [
    "Equipment Materials"
  ],
  "location": [
    "Germany"
  ],
  "main_products": [
    "Aerogel Powder &amp; Granules"
  ],
  "application_fields": [
    "Materials Research &amp; Development"
  ],
  "hero": ""
}