{
  "slug": "smc-industries-inc",
  "title": "SMC Industries, Inc.",
  "date": "Tue, 12 May 2026 07:10:18 +0000",
  "content": "<p>SMC Industries, Inc. supplies custom thermal insulation products for industrial projects and publicly markets precision-cut aerogel blanket solutions for piping, fittings, and vessel applications. The company positions its hydrophobic blanket offering for corrosion-under-insulation mitigation, thermal-efficiency retention, and easier field installation across process-industry environments.</p>\n<p>On its official website, SMC says it supports end users, contractors, engineering firms, and distributors and highlights project work in oil &amp; gas, petrochemical, LNG, and related industrial insulation markets. This makes the company relevant for buyers seeking fabricated aerogel-blanket supply and project-ready insulation support rather than raw aerogel manufacturing.</p>\n<ul>\n  <li><strong>Coverage Area:</strong> United States and international industrial project markets</li>\n  <li><strong>Focus Areas:</strong> Precision-cut aerogel blanket supply, custom insulation fabrication, industrial piping and vessel insulation, and corrosion-under-insulation risk reduction</li>\n  <li><strong>Current Brands Represented:</strong> Project-specified hydrophobic blanket systems and custom-fabricated aerogel insulation solutions; buyers should confirm brand and blanket specification directly with SMC</li>\n  <li><strong>Official Website:</strong> <a href=\"https://www.smcindustries.com/\" target=\"_blank\" rel=\"noopener\">https://www.smcindustries.com/</a></li>\n</ul>\n<!-- Workflow marker: Aerogela Auto Listing Series -->",
  "excerpt": "",
  "website": "https://www.smcindustries.com/",
  "certifications": "",
  "verified": "0",
  "review_status": "reviewed",
  "review_notes": "Directory profile reviewed for listing quality, category fit, and current public website availability.",
  "category": [
    "Distributors"
  ],
  "location": [
    "United States of America"
  ],
  "main_products": [
    "Aerogel Insulation Blanket",
    "Aerogel Materials Distribution"
  ],
  "application_fields": [
    "Industrial Insulation",
    "LNG &amp; Cryogenic Systems",
    "Petrochemical &amp; Oil &amp; Gas"
  ],
  "hero": ""
}