{
  "slug": "nuance-center",
  "title": "NUANCE Center",
  "date": "Tue, 21 Apr 2026 19:30:40 +0000",
  "content": "<p>Aerogel University Research Platform. The NUANCE Center (Northwestern University Atomic and Nanoscale Characterization Experimental Center) in Evanston, Illinois, is Northwestern's core multi-user characterization facility, providing 24/7 open access to state-of-the-art analytical instrumentation for the university community and external partners.</p>\n<p>Its integrated facilities span electron microscopy (EPIC), surface analysis with XPS and ToF-SIMS (Keck-II), micro-fabrication (NUFAB), and cryogenic and soft-matter characterization. With expert staff and training, NUANCE supports imaging and analysis of nanostructured and porous materials, making it a strong resource for aerogel morphology, composition, and surface-chemistry studies.</p>",
  "excerpt": "",
  "website": "https://nuance.northwestern.edu/",
  "certifications": "",
  "verified": "",
  "review_status": "reviewed",
  "review_notes": "Directory profile reviewed for listing quality, category fit, and current public website availability.",
  "category": [
    "Research Services"
  ],
  "location": [
    "United States of America"
  ],
  "main_products": [
    "Aerogel R&D and Testing Services"
  ],
  "application_fields": [
    "Materials Research & Development",
    "Testing & Characterization"
  ],
  "hero": ""
}
