{
 "slug": "institute-of-chemistry-chinese-academy-of-sciences",
 "title": "Institute of Chemistry, Chinese Academy of Sciences",
 "date": "Tue, 21 Apr 2026 19:06:40 +0000",
 "content": "<p>The Institute of Chemistry, Chinese Academy of Sciences (ICCAS), founded in 1956 in Beijing, is a national research institute covering polymer science, physical chemistry, organic and molecular sciences, and advanced materials. It hosts the CAS Key Laboratory of Engineering Plastics and the Laboratory of Polymer Physics and Chemistry, among other research divisions.</p>\n<p>ICCAS researchers have published influential aerogel work: the group of Jian Xu and Ning Zhao created superelastic polyimide nanofiber aerogels for thermal insulation and PM2.5 filtration, and fire-resistant polybenzazole (PBO) aerogels with ultralow density, thermal conductivity of 26-38 mW/m·K, and a 350 °C long-term use temperature. Other teams developed cellulose-based superhygroscopic aerogels for humidity control, with relevance to energy-efficient buildings, aerospace, and environmental applications.</p>",
 "excerpt": "",
 "website": "http://english.ic.cas.cn/",
 "certifications": "",
 "verified": "",
 "review_status": "reviewed",
 "review_notes": "Directory profile reviewed for listing quality, category fit, and current public website availability.",
 "category": [
  "Research Services"
 ],
 "location": [
  "China"
 ],
 "main_products": [
  "Aerogel R&D and Testing Services"
 ],
 "application_fields": [
  "Materials Research & Development",
  "Testing & Characterization"
 ],
 "hero": ""
}
