{
  "slug": "shandong-luyang-energy-saving-materials",
  "title": "Shandong Luyang Energy-Saving Materials Co., Ltd. | China Aerogel Materials Manufacturer",
  "date": "Thu, 16 Apr 2026 03:09:02 +0000",
  "content": "<p>Shandong Luyang Energy-Saving Materials Co., Ltd. is a large Chinese energy-saving materials manufacturer founded in 1984 and publicly listed in 2006. In addition to its well-known ceramic-fiber and high-temperature insulation businesses, the company publicly states that it applies aerogel composite materials to power-battery and energy-storage thermal-protection systems.</p>\n<h2>Company Overview</h2>\n<p>Luyang is a major Chinese high-temperature insulation materials company with large-scale manufacturing, broad export reach, and long-running technical capabilities. Its new-energy battery business publicly references ceramic fiber, nano insulation, and aerogel composite materials used for thermal safety, fire protection, and energy-efficiency management.</p>\n<h2>Coverage and Focus</h2>\n<ul>\n<li><strong>Coverage Area:</strong> China and more than 60 overseas markets.</li>\n<li><strong>Focus Areas:</strong> High-temperature insulation, energy-saving materials, EV battery thermal protection, energy-storage thermal safety, and industrial thermal management.</li>\n</ul>\n<h2>Main Products and Capacity</h2>\n<ul>\n<li>Aerogel composite materials for battery and energy-storage systems</li>\n<li>Nano insulation sheets and related thermal-protection products</li>\n<li>Ceramic-fiber paper and related high-temperature materials used in thermal-protection systems</li>\n<li><strong>Public Capacity:</strong> The company states overall annual capacity of nearly 600,000 tons of ceramic-fiber products; a separate aerogel-composite output figure is not clearly disclosed on the reviewed public pages.</li>\n</ul>\n<h2>Production Sites and Certifications</h2>\n<ul>\n<li><strong>Main Production Site:</strong> Zibo, Shandong, China.</li>\n<li><strong>International Certifications:</strong> Public pages emphasize large-scale manufacturing, patents, and recognized enterprise technical capabilities; specific aerogel-related international certifications are not clearly listed on the reviewed pages.</li>\n<li><strong>Official Website:</strong> <a href=\"https://www.luyang.com/\" target=\"_blank\" rel=\"noopener\">https://www.luyang.com/</a></li>\n</ul>\n<h2>FAQ</h2>\n<h3>What does Shandong Luyang Energy-Saving Materials Co., Ltd. manufacture?</h3>\n<p>Shandong Luyang Energy-Saving Materials Co., Ltd. publicly offers Aerogel Board & Panel, Aerogel Composite Materials, Battery Thermal Pad / Cell-to-Cell Barrier. Buyers commonly review this listing to understand the company’s product scope, production profile, and official website information before making contact.</p>\n<h3>Where is Shandong Luyang Energy-Saving Materials Co., Ltd. located?</h3>\n<p>Shandong Luyang Energy-Saving Materials Co., Ltd. is listed with production or operating presence in Zibo, Shandong, China.. Where more detailed plant information is publicly available, it is summarized in the Production Sites and Certifications section above.</p>\n<h3>Which industries does Shandong Luyang Energy-Saving Materials Co., Ltd. serve?</h3>\n<p>Shandong Luyang Energy-Saving Materials Co., Ltd. serves EV Batteries & Energy Storage, Fire Protection & Thermal Safety, Industrial Insulation. The public company profile and application materials indicate a focus on thermal insulation, safety, and energy-efficiency scenarios that use aerogel-based materials.</p>\n<h3>Does Shandong Luyang Energy-Saving Materials Co., Ltd. publish international certifications?</h3>\n<p>Public pages emphasize large-scale manufacturing, patents, and recognized enterprise technical capabilities; specific aerogel-related international certifications are not clearly listed on the reviewed pages.</p>",
  "excerpt": "",
  "website": "https://www.luyang.com/",
  "certifications": "",
  "verified": "",
  "review_status": "reviewed",
  "review_notes": "Directory profile reviewed for listing quality, category fit, and current public website availability.",
  "category": [
    "Aerogel Producers"
  ],
  "location": [
    "China"
  ],
  "main_products": [
    "Aerogel Board &amp; Panel",
    "Aerogel Composite Materials",
    "Battery Thermal Pad / Cell-to-Cell Barrier"
  ],
  "application_fields": [
    "EV Batteries &amp; Energy Storage",
    "Fire Protection &amp; Thermal Safety",
    "Industrial Insulation"
  ],
  "hero": ""
}