{
  "slug": "thar-process",
  "title": "Thar Process",
  "date": "Mon, 20 Apr 2026 18:02:00 +0000",
  "content": "<p>Thar Process is a U.S. engineering company focused on supercritical fluid processing equipment and related production systems. Its technology is relevant to aerogel process development where supercritical CO2 handling and drying workflows are important for laboratory, pilot, and industrial applications. Thar Process supports customers working on extraction, materials processing, and scale-up programs that require controlled supercritical systems.</p>",
  "excerpt": "",
  "website": "https://www.tharprocess.com/",
  "certifications": "",
  "verified": "",
  "review_status": "reviewed",
  "review_notes": "Directory profile reviewed for listing quality, category fit, and current public website availability.",
  "category": [
    "Equipment Materials"
  ],
  "location": [
    "United States of America"
  ],
  "main_products": [
    "Process Equipment &amp; Pilot Systems"
  ],
  "application_fields": [
    "Industrial Insulation",
    "LNG &amp; Cryogenic Systems",
    "Materials Research &amp; Development"
  ],
  "hero": ""
}