{
  "slug": "key-laboratory-of-synthetic-and-biological-colloids-jiangnan-university",
  "title": "Key Laboratory of Synthetic and Biological Colloids, Jiangnan University",
  "date": "Tue, 21 Apr 2026 19:09:40 +0000",
  "content": "<p>Aerogel University Research Platform. The Key Laboratory of Synthetic and Biological Colloids at Jiangnan University in Wuxi, China, is a key laboratory of the Ministry of Education founded in 2011. It researches colloid and interface chemistry, synthetic colloids, soft matter, and biocolloids.</p>\n<p>Research groups at the laboratory have carried out systematic work on aerogel functional composites, including polyimide nanofibrous aerogels for thermal insulation and ceramifiable polymer aerogels for thermal protection. Its strengths in colloidal assembly and polymer chemistry make it relevant for aerogel materials design, composite construction, and related characterization work.</p>",
  "excerpt": "",
  "website": "https://colloids.jiangnan.edu.cn/",
  "certifications": "",
  "verified": "",
  "review_status": "reviewed",
  "review_notes": "Directory profile reviewed for listing quality, category fit, and current public website availability.",
  "category": [
    "Research Services"
  ],
  "location": [
    "China"
  ],
  "main_products": [
    "Aerogel R&D and Testing Services"
  ],
  "application_fields": [
    "Materials Research & Development",
    "Testing & Characterization"
  ],
  "hero": ""
}
