{
  "slug": "3p-instruments",
  "title": "3P Instruments",
  "date": "Mon, 20 Apr 2026 18:04:00 +0000",
  "content": "<p>3P Instruments is a German supplier of gas sorption and particle characterization systems for porous materials research and industrial quality control. Its product range includes BET surface area and pore size analyzers that are directly relevant to aerogel development, benchmarking, and laboratory testing. The company serves users who need detailed characterization of adsorption behavior, porosity, and microstructure in high-performance insulation materials.</p>",
  "excerpt": "",
  "website": "https://www.3p-instruments.com/",
  "certifications": "",
  "verified": "",
  "review_status": "reviewed",
  "review_notes": "Directory profile reviewed for listing quality, category fit, and current public website availability.",
  "category": [
    "Equipment Materials"
  ],
  "location": [
    "Germany"
  ],
  "main_products": [
    "Aerogel Powder &amp; Granules",
    "Laboratory Equipment &amp; Instruments"
  ],
  "application_fields": [
    "Industrial Insulation",
    "Materials Research &amp; Development",
    "Testing &amp; Characterization"
  ],
  "hero": ""
}