{
  "slug": "millrock-technology",
  "title": "Millrock Technology",
  "date": "Mon, 20 Apr 2026 18:28:00 +0000",
  "content": "<p>Millrock Technology is a U.S. freeze dryer and lyophilizer manufacturer serving laboratory, pilot, and production environments. Its systems are relevant to porous-material and low-temperature drying workflows, including aerogel-adjacent research where controlled solvent removal and drying optimization are important. Millrock is a useful Equipment Materials listing for teams evaluating freeze-drying capabilities in advanced materials development.</p>",
  "excerpt": "",
  "website": "https://www.millrocktech.com/",
  "certifications": "",
  "verified": "",
  "review_status": "reviewed",
  "review_notes": "Directory profile reviewed for listing quality, category fit, and current public website availability.",
  "category": [
    "Equipment Materials"
  ],
  "location": [
    "United States of America"
  ],
  "main_products": [
    "Process Equipment &amp; Pilot Systems"
  ],
  "application_fields": [
    "Materials Research &amp; Development",
    "Process Scale-Up &amp; Manufacturing"
  ],
  "hero": ""
}