{
  "slug": "technical-institute-of-physics-and-chemistry-chinese-academy-of-sciences",
  "title": "Technical Institute of Physics and Chemistry, Chinese Academy of Sciences",
  "date": "Tue, 21 Apr 2026 19:03:40 +0000",
  "content": "<p>The Technical Institute of Physics and Chemistry (TIPC) of the Chinese Academy of Sciences, based in Beijing, conducts research in functional crystals, low-temperature physics and engineering, applied chemistry and laser technology.</p><p>Its researchers have contributed to aerogel science with work on crack-free monolithic silica aerogels prepared by vacuum freeze-drying, rapid synthesis of large-size ceramic aerogels, and flexible aerogel architectures for thermal insulation.</p><p>Leveraging this combination of low-temperature engineering and materials chemistry, TIPC cooperates with industry on aerogel processing routes, drying technologies and thermal protection applications.</p>",
  "excerpt": "CAS institute in Beijing with aerogel research spanning freeze-dried monolithic silica aerogels and rapid synthesis of large-size ceramic aerogels.",
  "website": "http://english.ipc.cas.cn/",
  "certifications": "",
  "verified": "",
  "review_status": "reviewed",
  "review_notes": "Directory profile reviewed for listing quality, category fit, and current public website availability.",
  "category": [
    "Research Services"
  ],
  "location": [
    "China"
  ],
  "main_products": [
    "Aerogel R&D and Testing Services"
  ],
  "application_fields": [
    "Materials Research & Development",
    "Testing & Characterization"
  ],
  "hero": ""
}
