{
  "slug": "aspen-aerogels-inc",
  "title": "Aspen Aerogels, Inc.",
  "date": "Fri, 10 Apr 2026 16:44:12 +0000",
  "content": "<p>Aspen Aerogels, Inc. is a US-based manufacturer of flexible silica aerogel insulation blankets, built on more than two decades of aerogel technology development. Its Pyrogel line (XTE, XTF, HPS) serves high-temperature refining, petrochemical, FPSO and power applications with hydrophobic protection against corrosion under insulation (CUI), while Cryogel Z provides cryogenic and LNG insulation with an integral vapor barrier, jet-fire protection and acoustic attenuation. The company also makes thin aerogel thermal barriers for electric-vehicle battery packs.</p><p>For buyers, Aspen's blankets deliver ultrathin, lightweight insulation that cuts installation time and space versus conventional materials, backed by a technical services team for specification and engineering.</p>",
  "excerpt": "US manufacturer of Pyrogel and Cryogel aerogel blankets for high-temperature, cryogenic/LNG and EV battery thermal insulation applications.",
  "website": "https://www.aerogel.com",
  "certifications": "",
  "verified": "1",
  "review_status": "verified",
  "review_notes": "Directory profile reviewed and marked verified based on current official website validation.",
  "category": [
    "Aerogel Producers"
  ],
  "location": [
    "United States of America"
  ],
  "main_products": [
    "Aerogel Insulation Blanket"
  ],
  "application_fields": [
    "Building & Construction",
    "Industrial Insulation"
  ],
  "hero": ""
}
