{
  "slug": "pacor-inc",
  "title": "Pacor, Inc.",
  "date": "Wed, 15 Apr 2026 08:58:56 +0000",
  "content": "<p>Pacor is an industrial insulation distributor and fabricator headquartered in New Jersey. The company serves industrial and OEM customers with custom conversion services and distributes multiple aerogel insulation products for hot and cold service applications.</p>\n<ul>\n  <li><strong>Coverage Area:</strong> United States</li>\n  <li><strong>Focus Areas:</strong> Industrial insulation fabrication, removable covers, pipe wrap, vessel insulation, OEM conversion, and aerogel blanket solutions</li>\n  <li><strong>Current Brands Represented:</strong> Aspen Aerogels (Pyrogel®, Cryogel®) and Johns Manville</li>\n  <li><strong>Official Website:</strong> <a href=\"https://www.pacorinc.com\" target=\"_blank\" rel=\"noopener\">https://www.pacorinc.com</a></li>\n</ul>",
  "excerpt": "",
  "website": "https://www.pacorinc.com",
  "certifications": "",
  "verified": "",
  "review_status": "reviewed",
  "review_notes": "Directory profile reviewed for listing quality, category fit, and current public website availability.",
  "category": [
    "Distributors"
  ],
  "location": [
    "United States of America"
  ],
  "main_products": [
    "Aerogel Insulation Blanket",
    "Aerogel Pipe Shell &amp; Cover"
  ],
  "application_fields": [
    "Industrial Insulation",
    "LNG &amp; Cryogenic Systems"
  ],
  "hero": ""
}