{
  "slug": "wynca-group",
  "title": "Wynca Group",
  "date": "Mon, 20 Apr 2026 18:14:00 +0000",
  "content": "<p>Wynca Group is a Chinese silicon-based materials supplier with official product positioning across silicone monomers, intermediates, rubbers, fluids, silanes, and resins. This makes the company relevant to aerogel upstream sourcing where silane chemistry and related organosilicon materials are important for precursor systems, surface modification, and formulation work. Wynca is a suitable Equipment Materials listing for technical buyers evaluating large-scale Asian sources of silicon-based chemistry.</p>",
  "excerpt": "",
  "website": "https://www.wynca.com/en",
  "certifications": "",
  "verified": "",
  "review_status": "reviewed",
  "review_notes": "Directory profile reviewed for listing quality, category fit, and current public website availability.",
  "category": [
    "Equipment Materials"
  ],
  "location": [
    "China"
  ],
  "main_products": [
    "Aerogel Coating &amp; Slurry",
    "Silanes, Precursors &amp; Additives"
  ],
  "application_fields": [
    "Materials Research &amp; Development",
    "Process Scale-Up &amp; Manufacturing"
  ],
  "hero": ""
}