{
  "slug": "hot-disk-ab",
  "title": "Hot Disk AB",
  "date": "Mon, 20 Apr 2026 18:05:00 +0000",
  "content": "<p>Hot Disk AB is a Swedish instrumentation company that develops thermal property measurement systems for low-density and highly insulating materials. Its official low-density measurement module is positioned for ultra-low thermal conductivity testing and specifically references aerogels, making the company a relevant equipment supplier for aerogel research, product development, and quality characterization. Hot Disk systems are widely used for measuring thermal conductivity, thermal diffusivity, and related properties in porous insulation materials.</p>",
  "excerpt": "",
  "website": "https://www.hotdiskinstruments.com/",
  "certifications": "",
  "verified": "",
  "review_status": "reviewed",
  "review_notes": "Directory profile reviewed for listing quality, category fit, and current public website availability.",
  "category": [
    "Equipment Materials"
  ],
  "location": [
    "Sweden"
  ],
  "main_products": [
    "Laboratory Equipment &amp; Instruments"
  ],
  "application_fields": [
    "Materials Research &amp; Development",
    "Testing &amp; Characterization"
  ],
  "hero": ""
}