{
  "slug": "thermablok",
  "title": "Thermablok Aerogel Insulation",
  "date": "Sun, 12 Apr 2026 05:04:59 +0000",
  "content": "<p>Thermablok is a well-known supplier of aerogel-based insulation solutions for the building sector. The company commercializes thin-profile aerogel insulation products designed to reduce thermal bridging in residential, commercial, and retrofit construction projects.</p>\n<ul>\n  <li><strong>Coverage Area:</strong> North America, the United Kingdom, and selected international markets</li>\n  <li><strong>Focus Areas:</strong> Thermal-bridge mitigation, building-envelope upgrades, retrofit insulation, window and door interfaces, and thin-profile construction insulation</li>\n  <li><strong>Current Brands Represented:</strong> Thermablok® aerogel insulation products</li>\n  <li><strong>Official Website:</strong> <a href=\"https://www.thermablok.com\" target=\"_blank\" rel=\"noopener\">https://www.thermablok.com</a></li>\n</ul>",
  "excerpt": "",
  "website": "https://www.thermablok.com",
  "certifications": "",
  "verified": "",
  "review_status": "reviewed",
  "review_notes": "Directory profile reviewed for listing quality, category fit, and current public website availability.",
  "category": [
    "Distributors"
  ],
  "location": [
    "United States of America"
  ],
  "main_products": [
    "Aerogel Insulation Blanket"
  ],
  "application_fields": [
    "Building &amp; Construction"
  ],
  "hero": ""
}