{
  "slug": "aerogel-it-gmbh",
  "title": "Aerogel-it GmbH",
  "date": "Wed, 15 Apr 2026 08:59:01 +0000",
  "content": "<p>Aerogel-it is a Germany-based distributor and application specialist focused on aerogel products for construction and advanced industrial use. The company serves as the exclusive DACH distribution channel for selected silica aerogel blanket systems.</p>\n<ul>\n  <li><strong>Coverage Area:</strong> Germany, Austria, and Switzerland</li>\n  <li><strong>Focus Areas:</strong> Construction insulation, EV battery heat shields, thin aerogel boards, and high-performance thermal-protection solutions</li>\n  <li><strong>Current Brands Represented:</strong> Beerenberg (Oryza BGT) and other aerogel solutions</li>\n  <li><strong>Official Website:</strong> <a href=\"https://aerogel-it.de\" target=\"_blank\" rel=\"noopener\">https://aerogel-it.de</a></li>\n</ul>",
  "excerpt": "",
  "website": "https://aerogel-it.de",
  "certifications": "",
  "verified": "",
  "review_status": "reviewed",
  "review_notes": "Directory profile reviewed for listing quality, category fit, and current public website availability.",
  "category": [
    "Distributors"
  ],
  "location": [
    "Germany"
  ],
  "main_products": [
    "Aerogel Board &amp; Panel",
    "Aerogel Insulation Blanket",
    "Battery Thermal Pad / Cell-to-Cell Barrier"
  ],
  "application_fields": [
    "Building &amp; Construction",
    "EV Batteries &amp; Energy Storage",
    "Industrial Insulation"
  ],
  "hero": ""
}