{
  "slug": "molecular-foundry",
  "title": "Molecular Foundry",
  "date": "Tue, 21 Apr 2026 19:23:40 +0000",
  "content": "<p>Aerogel National Laboratory. The Molecular Foundry at Lawrence Berkeley National Laboratory in Berkeley, California, is a U.S. Department of Energy Office of Science user facility for nanoscience. It gives researchers from around the world access to leading-edge instrumentation and staff expertise across synthesis, fabrication, characterization, and theory of nanoscale materials.</p>\n<p>Its multidisciplinary environment supports the design of porous and nanostructured materials, making it relevant for aerogel synthesis routes, imaging of nanoscale architecture, and structure-property studies. External users collaborate with staff or access facilities through a peer-reviewed proposal process.</p>",
  "excerpt": "",
  "website": "https://foundry.lbl.gov/",
  "certifications": "",
  "verified": "",
  "review_status": "reviewed",
  "review_notes": "Directory profile reviewed for listing quality, category fit, and current public website availability.",
  "category": [
    "Research Services"
  ],
  "location": [
    "United States of America"
  ],
  "main_products": [
    "Aerogel R&D and Testing Services"
  ],
  "application_fields": [
    "Materials Research & Development",
    "Testing & Characterization"
  ],
  "hero": ""
}
