{
  "slug": "buchi-labortechnik-ag",
  "title": "BÜCHI Labortechnik AG",
  "date": "Mon, 20 Apr 2026 18:23:00 +0000",
  "content": "<p>BÜCHI Labortechnik AG is a Swiss laboratory equipment manufacturer known for evaporation, spray drying, extraction, and lyophilization systems. These process tools are relevant to aerogel formulation, solvent exchange, drying, and analytical sample-preparation workflows. BÜCHI is a strong Equipment Materials listing for research and pilot teams needing reliable laboratory process platforms.</p>",
  "excerpt": "",
  "website": "https://www.buchi.com/en",
  "certifications": "",
  "verified": "",
  "review_status": "reviewed",
  "review_notes": "Directory profile reviewed for listing quality, category fit, and current public website availability.",
  "category": [
    "Equipment Materials"
  ],
  "location": [
    "Switzerland"
  ],
  "main_products": [
    "Aerogel Coating &amp; Slurry",
    "Process Equipment &amp; Pilot Systems"
  ],
  "application_fields": [
    "Materials Research &amp; Development",
    "Process Scale-Up &amp; Manufacturing"
  ],
  "hero": ""
}